No,Prefecture,code_pref,Hospital,Corporation,Address,Type,Y,X,Underpopulated,Mountainous,RI,Peninsula,Snowfall,Agricultural
505,北九州市,40,三原デイケア＋クリニックりぼん・りぼん,医療法人　りぼん・りぼん,福岡県北九州市小倉北区宇佐町１－９－３０,4,33.8759368961876,130.891473990164,,,,,,
506,北九州市,40,かん養生クリニック,医療法人　かん養生クリニック,福岡県北九州市小倉南区湯川新町３－７－１,4,33.8419804721112,130.902750502671,,,,,,
507,福岡市,40,九州大学病院,国立大学法人　九州大学,福岡県福岡市東区馬出3-1-1,3,33.6098134726124,130.415753587856,,,,,,
508,福岡市,40,福岡大学病院,学校法人　福岡大学,福岡県福岡市城南区七隈7-45-1,3,33.5476394706419,130.359803949922,,,,,,
509,熊本市,43,くまもと青明病院,一般財団法人　杏仁会,熊本県熊本市中央区渡鹿5丁目1番37号,3,32.810475299393,130.730062011976,,,,,,
